{
  "schema_version": "openguard.notice-license-facts/2",
  "package_status": "draft_facts_only",
  "generated_at": "2026-09-21T15:25:00Z",
  "source_package": {
    "path": "tests/fixtures/notice-license-facts-v1/facts.json",
    "schema_version": "openguard.notice-license-facts/1",
    "fixed_commit": "e2d8c016ef5f4cfcddd23abb0205ec41c7cf3db1",
    "source_file_sha256": "df3d51a696c0e4fc2eca591ced45642fbbea09b60656548ecc136720dada0e99",
    "commit_blob_sha256": "df3d51a696c0e4fc2eca591ced45642fbbea09b60656548ecc136720dada0e99"
  },
  "producer": {
    "name": "openguard-b03-b04-facts",
    "version": "2.0.0"
  },
  "evidence": [
    {
      "evidence_id": "ev.root.license",
      "kind": "repository_file",
      "locator": "LICENSE",
      "source_url": null,
      "source_revision": "e2d8c016ef5f4cfcddd23abb0205ec41c7cf3db1",
      "content_scope": "whole_file",
      "source_file_sha256": "c71d239df91726fc519c6eb72d318ec65820627232b2f796219e87dcf35d0ab4",
      "container_sha256": null,
      "selected_content_sha256": "c71d239df91726fc519c6eb72d318ec65820627232b2f796219e87dcf35d0ab4",
      "selected_json_pointer": null,
      "excerpt": "Apache License Version 2.0, January 2004",
      "verification": "repository_bytes_verified",
      "captured_at": "2026-09-20T17:06:00.000Z",
      "producer": {
        "name": "openguard-b03-b04-facts",
        "version": "2.0.0"
      }
    },
    {
      "evidence_id": "ev.jackson.license",
      "kind": "archive_entry",
      "locator": "com.fasterxml.jackson.core:jackson-databind:2.21.5!/META-INF/LICENSE",
      "source_url": "https://repo1.maven.org/maven2/com/fasterxml/jackson/core/jackson-databind/2.21.5/jackson-databind-2.21.5.jar",
      "source_revision": null,
      "content_scope": "archive_entry",
      "source_file_sha256": "507418c0fafd38b2b2cfb704521630da613a8e4cc8381195a6f418017883e2c0",
      "container_sha256": "507418c0fafd38b2b2cfb704521630da613a8e4cc8381195a6f418017883e2c0",
      "selected_content_sha256": "cfc7749b96f63bd31c3c42b5c471bf756814053e847c10f3eb003417bc523d30",
      "selected_json_pointer": null,
      "excerpt": "Apache License Version 2.0, January 2004",
      "verification": "archive_bytes_verified",
      "captured_at": "2026-09-20T17:06:00.000Z",
      "producer": {
        "name": "openguard-b03-b04-facts",
        "version": "2.0.0"
      }
    },
    {
      "evidence_id": "ev.jackson.notice",
      "kind": "archive_entry",
      "locator": "com.fasterxml.jackson.core:jackson-databind:2.21.5!/META-INF/NOTICE",
      "source_url": "https://repo1.maven.org/maven2/com/fasterxml/jackson/core/jackson-databind/2.21.5/jackson-databind-2.21.5.jar",
      "source_revision": null,
      "content_scope": "archive_entry",
      "source_file_sha256": "507418c0fafd38b2b2cfb704521630da613a8e4cc8381195a6f418017883e2c0",
      "container_sha256": "507418c0fafd38b2b2cfb704521630da613a8e4cc8381195a6f418017883e2c0",
      "selected_content_sha256": "612b14bc77c944ce229cbba0d14919162cfea8ed802cbf06a8e865e032d03201",
      "selected_json_pointer": null,
      "excerpt": "Jackson JSON processor; Copyright 2007-, Tatu Saloranta",
      "verification": "archive_bytes_verified",
      "captured_at": "2026-09-20T17:06:00.000Z",
      "producer": {
        "name": "openguard-b03-b04-facts",
        "version": "2.0.0"
      }
    },
    {
      "evidence_id": "ev.springboot.license",
      "kind": "archive_entry",
      "locator": "org.springframework.boot:spring-boot:4.1.1!/META-INF/LICENSE.txt",
      "source_url": "https://repo1.maven.org/maven2/org/springframework/boot/spring-boot/4.1.1/spring-boot-4.1.1.jar",
      "source_revision": null,
      "content_scope": "archive_entry",
      "source_file_sha256": "0d92b532b1d4020640e72d78c31af175c23db8e0ddd45b81855b7fdf4c9c70f0",
      "container_sha256": "0d92b532b1d4020640e72d78c31af175c23db8e0ddd45b81855b7fdf4c9c70f0",
      "selected_content_sha256": "7200000367e0e8b47822d563a5ddd2dd3a97cc05b32bd7dbcc7b4eeb92b76628",
      "selected_json_pointer": null,
      "excerpt": "Apache License Version 2.0, January 2004",
      "verification": "archive_bytes_verified",
      "captured_at": "2026-09-20T17:06:00.000Z",
      "producer": {
        "name": "openguard-b03-b04-facts",
        "version": "2.0.0"
      }
    },
    {
      "evidence_id": "ev.springboot.notice",
      "kind": "archive_entry",
      "locator": "org.springframework.boot:spring-boot:4.1.1!/META-INF/NOTICE.txt",
      "source_url": "https://repo1.maven.org/maven2/org/springframework/boot/spring-boot/4.1.1/spring-boot-4.1.1.jar",
      "source_revision": null,
      "content_scope": "archive_entry",
      "source_file_sha256": "0d92b532b1d4020640e72d78c31af175c23db8e0ddd45b81855b7fdf4c9c70f0",
      "container_sha256": "0d92b532b1d4020640e72d78c31af175c23db8e0ddd45b81855b7fdf4c9c70f0",
      "selected_content_sha256": "64e8c092d64ccaecac2d81d324c84a4dff29fdc2cb777f3b1abd910ac2e8555d",
      "selected_json_pointer": null,
      "excerpt": "Spring Boot 4.1.1; Copyright (c) 2012-2026 VMware, Inc.",
      "verification": "archive_bytes_verified",
      "captured_at": "2026-09-20T17:06:00.000Z",
      "producer": {
        "name": "openguard-b03-b04-facts",
        "version": "2.0.0"
      }
    },
    {
      "evidence_id": "ev.hamcrest.license",
      "kind": "archive_entry",
      "locator": "org.hamcrest:hamcrest:3.0!/META-INF/LICENSE",
      "source_url": "https://repo1.maven.org/maven2/org/hamcrest/hamcrest/3.0/hamcrest-3.0.jar",
      "source_revision": null,
      "content_scope": "archive_entry",
      "source_file_sha256": "5d66b6a4a680755cb6ed7cb104fa7835ef644667586ff0737adeb977c39ecdbc",
      "container_sha256": "5d66b6a4a680755cb6ed7cb104fa7835ef644667586ff0737adeb977c39ecdbc",
      "selected_content_sha256": "1710cf0fc79043bb1ea1e6b3af96a3e8def96c4239794a17b0b95966e75929b8",
      "selected_json_pointer": null,
      "excerpt": "BSD 3-Clause License; Copyright (c) 2000-2024, www.hamcrest.org",
      "verification": "archive_bytes_verified",
      "captured_at": "2026-09-20T17:06:00.000Z",
      "producer": {
        "name": "openguard-b03-b04-facts",
        "version": "2.0.0"
      }
    },
    {
      "evidence_id": "ev.mockito.license",
      "kind": "archive_entry",
      "locator": "org.mockito:mockito-core:5.23.0!/LICENSE",
      "source_url": "https://repo1.maven.org/maven2/org/mockito/mockito-core/5.23.0/mockito-core-5.23.0.jar",
      "source_revision": null,
      "content_scope": "archive_entry",
      "source_file_sha256": "ae295bebd5d11fab97ab297815dc7617188b86003cbce3dfd5c0d5c3a6cc4a0c",
      "container_sha256": "ae295bebd5d11fab97ab297815dc7617188b86003cbce3dfd5c0d5c3a6cc4a0c",
      "selected_content_sha256": "fc37ea05c14706d13ec54d477a5c8c456aec1a5393779c683404b0151d04d7d7",
      "selected_json_pointer": null,
      "excerpt": "The MIT License; Copyright (c) 2007 Mockito contributors",
      "verification": "archive_bytes_verified",
      "captured_at": "2026-09-20T17:06:00.000Z",
      "producer": {
        "name": "openguard-b03-b04-facts",
        "version": "2.0.0"
      }
    },
    {
      "evidence_id": "ev.hf.gpt2.license",
      "kind": "provider_snapshot",
      "locator": "tests/fixtures/huggingface/resource-profile-v1/snapshots/models/openai-community--gpt2.json#/payload/cardData/license",
      "source_url": "https://huggingface.co/api/models/openai-community/gpt2",
      "source_revision": "23fae26485db2fe3449ec8e7cccc3af64a487002",
      "content_scope": "json_pointer_value",
      "source_file_sha256": "2e1ba694ae9f2afb6e46867c73215739dab87bcf0e0d69816d63ecefafd075f9",
      "container_sha256": null,
      "selected_content_sha256": "6b53974263891131c47ff5af1bca9a352fc18e8ff6483d6d0c34a7eefa923377",
      "selected_json_pointer": "/payload/cardData/license",
      "excerpt": "Provider-declared raw value: mit",
      "verification": "fixture_bytes_verified",
      "captured_at": "2026-09-20T17:06:00.000Z",
      "producer": {
        "name": "openguard-b03-b04-facts",
        "version": "2.0.0"
      }
    },
    {
      "evidence_id": "ev.hf.bert.license",
      "kind": "provider_snapshot",
      "locator": "tests/fixtures/huggingface/resource-profile-v1/snapshots/models/google-bert--bert-base-uncased.json#/payload/cardData/license",
      "source_url": "https://huggingface.co/api/models/google-bert/bert-base-uncased",
      "source_revision": "23fae26485db2fe3449ec8e7cccc3af64a487002",
      "content_scope": "json_pointer_value",
      "source_file_sha256": "dc293e547c6cb125a94305654420a49aa3d930b39bd55309bd8e323b0ce865dc",
      "container_sha256": null,
      "selected_content_sha256": "ce0956e2a0986dae20f5c028b3b4d67f4b8eda4811a48c1a3673913409301023",
      "selected_json_pointer": "/payload/cardData/license",
      "excerpt": "Provider-declared raw value: apache-2.0",
      "verification": "fixture_bytes_verified",
      "captured_at": "2026-09-20T17:06:00.000Z",
      "producer": {
        "name": "openguard-b03-b04-facts",
        "version": "2.0.0"
      }
    },
    {
      "evidence_id": "ev.hf.imdb.license",
      "kind": "provider_snapshot",
      "locator": "tests/fixtures/huggingface/resource-profile-v1/snapshots/datasets/stanfordnlp--imdb.json#/payload/cardData/license",
      "source_url": "https://huggingface.co/api/datasets/stanfordnlp/imdb",
      "source_revision": "23fae26485db2fe3449ec8e7cccc3af64a487002",
      "content_scope": "json_pointer_value",
      "source_file_sha256": "3d49996e64d52e01a6085382bb1c706489c3fda0422fcfa4a03658eb502c8766",
      "container_sha256": null,
      "selected_content_sha256": "c8c317de489c9971a7dbb62622af5caf41de5c0c20095c1ac0f1ac5fda104d6d",
      "selected_json_pointer": "/payload/cardData/license",
      "excerpt": "Provider-declared raw value: [other]",
      "verification": "fixture_bytes_verified",
      "captured_at": "2026-09-20T17:06:00.000Z",
      "producer": {
        "name": "openguard-b03-b04-facts",